ID,TITLE,SUBTITLE,AUTHORS,PUBLISHED_ON,URL,SENTIMENT,SOURCE_NAME,CATEGORIES,KEYWORDS,BODY
51825099,"UBS, PostFinance and Sygnum Conduct Cross-Bank Payments on Ethereum","The proof of concept, run under the Swiss Bankers Association, saw UBS, PostFinance, and Sygnum Bank carry out transactions using deposit tokens.","Ian Allison,AI Boost",1758030715,https://www.coindesk.com/business/2025/09/16/ubs-postfinance-and-sygnum-do-cross-bank-payments-on-a-public-blockchain,POSITIVE,CoinDesk,"CRYPTOCURRENCY, ETH, SPONSORED, BLOCKCHAIN, FIAT",Finance|payments|banking|Switzerland|UBS|Sygnum|News,"Swiss banking powerhouse UBS, crypto banking specialist Sygnum and PostFinance, a subsidiary company of the state-owned Swiss Post, successfully tested payments between institutions on Ethereum, according to a press release on Tuesday. The proof of concept, run under the Swiss Bankers Association, saw UBS, PostFinance, and Sygnum Bank carry out transactions using deposit tokens — digital representations of bank deposits that can move on a public blockchain. The payments were settled legally between banks without relying on the traditional payment system. The transactions were conducted on Ethereum using a permissioned framework. Switzerland already has an efficient domestic payments network, but traditional systems can’t handle programmable conditions or integrate easily with blockchain-based markets, the companies said. With deposit tokens, transfers could in the future be processed instantly and tied to automated conditions through smart contracts. For example, a securities trade could settle as soon as ownership is transferred, or an insurance payout could trigger once a claim is validated. The trial tested two use cases: peer-to-peer payments between customers of different banks and an escrow-like setup where deposit tokens were swapped for tokenized assets. While the project confirmed technical and legal feasibility, scaling the system will require broader participation from banks, infrastructure providers and regulators. The Swiss Bankers Association said the work falls under its strategic priority on digital currencies, but the pilot does not mean deposit tokens will be introduced immediately."
51825097,"Is Ethereum’s DeFi Future on L2s? Liquidity, Innovation Say Perhaps Yes","Ethereum is in the midst of a paradox. Even as ether hit record highs in late August, decentralized finance (DeFi) activity on Ethereum’s layer-1 (L1) looks muted compared to its peak in late 2021. Meanwhile, layer-2 (L2) networks like Arbitrum and Base are booming, with billions in total value locked (TVL). 
",Margaux Nijkerk,1758029174,https://www.coindesk.com/tech/2025/09/15/is-ethereum-s-defi-future-on-l2s-liquidity-innovation-say-perhaps-yes,NEUTRAL,CoinDesk,"CRYPTOCURRENCY, ETH, ARB, BLOCKCHAIN, TRADING",Tech|DeFi|Ethereum|layer 2|News,"Ethereum is in the midst of a paradox. Even as ether hit record highs in late August, decentralized finance (DeFi) activity on Ethereum’s layer-1 (L1) looks muted compared to its peak in late 2021. Fees collected on mainnet in August were just $44 million, a 44% drop from the prior month. Meanwhile, layer-2 (L2) networks like Arbitrum and Base are booming, with $20 billion and $15 billion in total value locked (TVL) respectively. This divergence raises a crucial question: are L2s cannibalizing Ethereum’s DeFi activity, or is the ecosystem evolving into a multi-layered financial architecture? AJ Warner, the chief strategy officer of Offchain Labs, the developer firm behind layer-2 Arbitrum, argues that the metrics are more nuanced than just layer-2 DeFi chipping at the layer 1. In an interview with CoinDesk, Warner said that focusing solely on TVL misses the point, and that Ethereum is increasingly functioning as crypto’s “global settlement layer,” a foundation for high-value issuance and institutional activity. Products like Franklin Templeton’s tokenized funds or BlackRock’s BUIDL product launch directly on Ethereum L1 — activity that isn’t fully captured in DeFi metrics but underscores Ethereum’s role as the bedrock of crypto finance. Ethereum as a layer-1 blockchain is the secure but relatively slow and expensive base network. Layer-2s are scaling networks built on top of it, designed to handle transactions faster and at a fraction of the cost before ultimately settling back to Ethereum for security. That’s why they’ve become so appealing to traders and builders alike. Metrics like TVL, the amount of crypto deposited in DeFi protocols, highlight this shift, as activity is moved to L2s where lower fees and quicker confirmations make everyday DeFi far more practical. Warner likens Ethereum’s place in the ecosystem to a wire transfer in traditional finance: trusted, secure and used for large-scale settlement. Everyday transactions, however, are migrating to L2s — the Venmos and PayPals of crypto. “Ethereum was never going to be a monolithic blockchain with all the activity happening on it,” Warner told CoinDesk. Instead, it’s meant to anchor security while enabling rollups to execute faster, cheaper and more diverse applications. Layer 2s, which have exploded over the last few years because they are seen as the faster and cheaper alternative to Ethereum, enable whole categories of DeFi that don’t function as well on mainnet. Fast-paced trading strategies, like arbitraging price differences between exchanges or running perpetual futures, don’t work well on Ethereum’s slower 12-second blocks. But on Arbitrum, where transactions finalize in under a second, those same strategies become possible, Warner explained. This is apparent, as Ethereum has had fewer than 50 million transactions over the last month, compared to Base’s 328 million transactions and Arbitrum’s 77 million transactions, according to L2Beat . Builders also see L2s as an ideal testing ground. Alice Hou, a research analyst at Messari, pointed to innovations like Uniswap V4’s hooks , customizable features that can be iterated far more cheaply on L2s before going mainstream. For developers, quicker confirmations and lower costs are more than a convenience: they expand what’s possible. “L2s provide a natural playground to test these kinds of innovations, and once a hook achieves breakout popularity, it could attract new types of users who engage with DeFi in ways that weren’t feasible on L1,” Hou said. But the shift isn’t just about technology. Liquidity providers are responding to incentives. Hou said that data shows smaller liquidity providers increasingly prefer L2s where yield incentives and lower slippage amplify returns. Larger liquidity providers, however, still cluster on Ethereum, prioritizing security and depth of liquidity over bigger yields. Interestingly, while L2s are capturing more activity, flagship DeFi protocols like Aave and Uniswap still lean heavily on mainnet. Aave has consistently kept about 90% of its TVL on Ethereum. With Uniswap however, there’s been an incremental shift towards L2 activity. Another factor accelerating L2 adoption is user experience. Wallets, bridges and fiat on-ramps increasingly steer newcomers directly to L2s, Hou said. Ultimately, the data suggests the L1 vs. L2 debate isn’t zero-sum. As of September 2025, about a third of L2 TVL still comes bridged from Ethereum , another third is natively minted, and the rest comes via external bridges. “This mix shows that while Ethereum remains a key source of liquidity, L2s are also developing their own native ecosystems and attracting cross-chain assets,” Hou said. Ethereum thus as a base layer appears to be cementing itself as the secure settlement engine for global finance, while rollups like Arbitrum and Base are emerging as execution layers for fast, cheap and creative DeFi applications. “Most payments I make use something like Zelle or PayPal… but when I boug"
51769014,Ethereum Foundation Starts New AI Team to Support Agentic Payments,"Research scientist Davide Crapis announced a new EF unit focused on AI payments, coordination and standards like ERC-8004 to ensure decentralized, verifiable infrastructure.","Siamak Masnavi,AI Boost",1757945000,https://www.coindesk.com/tech/2025/09/15/ethereum-foundation-launches-ai-team-to-support-agentic-payments,POSITIVE,CoinDesk,"CRYPTOCURRENCY, ETH, BLOCKCHAIN, RESEARCH, BUSINESS",Tech|Ethereum|Ethereum Foundation|AI|News,"The Ethereum Foundation (EF) is creating a dedicated artificial intelligence (AI) group to make Ethereum the settlement and coordination layer for what it calls the “machine economy,” according to research scientist Davide Crapis . Crapis, who announced the initiative Monday on X, said the new dAI Team will pursue two priorities: enabling AI agents to pay and coordinate without intermediaries, and building a decentralized AI stack that avoids reliance on a small number of large companies. He said Ethereum’s neutrality, verifiability and censorship resistance make it a natural base layer for intelligent systems. Ethereum Foundation background The EF is a non-profit organization based in Zug, Switzerland, that funds and coordinates the development of the Ethereum blockchain. It does not control the network but plays a catalytic role by supporting researchers, developers and ecosystem projects. Its remit includes funding upgrades such as Ethereum 2.0, zero-knowledge proofs and layer-2 scaling, alongside community programs like the Ecosystem Support Program. The foundation also organizes events such as Devcon to foster collaboration and acts as a policy advocate for blockchain adoption. In 2025, EF restructured to handle Ethereum’s growth, emphasizing ecosystem acceleration, founder support and enterprise outreach. The new dAI Team represents a continuation of this shift toward specialized units addressing emerging technologies. Crapis’s role Crapis is a research scientist at the EF and will lead the new dAI Team. He said the group will connect its work with both the EF’s protocol group and its ecosystem support arm. “Ethereum makes AI more trustworthy, and AI makes Ethereum more useful,” he wrote, adding that the team intends to fund public goods and projects at the intersection of AI and blockchains. ERC-8004 and Trust Standards The group will build on recent work around ERC-8004, a proposed Ethereum standard that Crapis described as a way to prove who an AI agent is and whether it can be trusted. By offering identity and reputation systems for autonomous agents, the standard is intended to allow coordination without centralized gatekeepers. Crapis said the team will support new standards and upgrades as they emerge, guided by Ethereum’s values and the “d/acc” philosophy of decentralized acceleration. The goal, he explained, is to ensure AI development remains open and verifiable while giving humans greater agency over how intelligent systems interact with the economy. Why it matters For Ethereum, the move signals a growing ambition to anchor emerging technologies beyond finance. If AI agents begin transacting at scale, demand could grow for settlement rails, reputation systems and standards that run natively on Ethereum. For the AI community, the initiative offers an alternative to centralized platforms that currently dominate AI infrastructure. “The more intelligent agents transact, the more they need a neutral base layer for value and reputation,” Crapis said. “Ethereum benefits by becoming that layer and AI benefits by escaping lock-in to a few centralized platforms.” The team has begun hiring and publishing resources, according to Crapis. He said EF intends to work “with purpose and urgency” to connect AI developers with the Ethereum ecosystem and to accelerate research at the boundary of the two fields."
51511128,Ethereum Rare Mass Slashing Event Linked To Operator Issues,"The validators were tied to the SSV Network, a distributed validator technology protocol that decentralizes staking infrastructure.","Margaux Nijkerk,AI Boost",1757527758,https://www.coindesk.com/tech/2025/09/10/ethereum-rare-mass-slashing-event-linked-to-operator-issues,NEGATIVE,CoinDesk,"CRYPTOCURRENCY, ETH, SSV, BLOCKCHAIN, TECHNOLOGY",Tech|Ethereum|slashing|distributed validator technology|Validators|Beacon Chain|News,"Ethereum experienced a rare slashing event on Wednesday, with 39 validators penalized, according to blockchain explorer Beaconcha.in . The validators were tied to the SSV Network, a distributed validator technology (DVT) protocol that decentralizes staking infrastructure by splitting validator keys across multiple operators. Despite the scale of the incident, SSV founder Alon Muroch emphasized that the protocol itself was not compromised. Instead, the penalties stemmed from operator-side infrastructure issues involving third-party staking providers using SSV. One cluster of slashed validators was tied to Ankr, a liquid staking provider. According to Muroch, routine maintenance on Ankr’s systems triggered the event. A second slashing involved a validator cluster that had migrated from Allnodes two months earlier. Investigators believe a secondary validator setup caused the duplicate signing that led to penalties. In total, 39 validators were slashed, making this one of the largest correlated slashing events since Ethereum’s transition to proof-of-stake. Each validator slashed faces an immediate ETH penalty and could face inactivity leaks , compounded losses. One validator, backed by a 2,020 ETH stake, lost around 0.3 ETH , or about $1,300 at today’s prices, in the process. While slashing is built into Ethereum’s design as a deterrent against malicious or negligent behavior, it remains exceedingly rare. Fewer than 500 validators out of more than 1.2 million active have been slashed since the Beacon Chain went live in 2020. Most incidents, including this one, have been traced to operator issues rather than deliberate attacks. Mass slashings are particularly notable because correlated misbehavior increases the severity of penalties. Ethereum’s protocol enforces additional inactivity leaks when groups of validators are slashed together, amplifying the financial impact. For Ethereum’s staking ecosystem, the latest wave underscores a familiar but critical lesson: validator safety hinges as much on infrastructure and operator diligence as on the protocol itself. Even when the underlying software is uncompromised, operational errors can have costly and very public consequences. Read more: ‘Keep It Simple’: Prevent Your Eth 2.0 From Being Slashed"
